course_title,price,Free/Paid,num_subscribers,num_reviews,num_lectures,level,Rating,content_duration,published_timestamp,subjectProjects in CSS,60,Paid,4689,216,54,Beginner Level,3,10,2014-09-23T06:13:59Z,Subject: Web Development
Angular JS Essentials,195,Paid,4687,99,24,All Levels,1,4,2017-01-03T15:31:13Z,Subject: Web Development
How to Build Your Own Website with WordPress: A Step-by-Step Guide,95,Paid,4675,15,56,Beginner Level,1,6,2015-03-05T01:18:27Z,Subject: Web Development
Flask Tutorial Step by Step,0,Free,4645,171,19,All Levels,5,2,2017-02-28T16:27:45Z,Subject: Web Development
Projects in MongoDB - Learn MongoDB Building Projects,50,Paid,4628,247,93,Intermediate Level,1,12,2015-09-28T20:22:39Z,Subject: Web Development
Creating FaceBook Design Using Bootstrap - Handson Project,80,Paid,4616,20,19,All Levels,2,2,2016-12-06T23:46:15Z,Subject: Web Development
JavaScript for beginners with live examples,195,Paid,4587,46,49,Beginner Level,1,4,2015-09-29T21:41:16Z,Subject: Web Development
Devtools 2017: The Basics of Chrome Developer Tools,0,Free,4569,108,18,All Levels,1,1,2017-04-14T16:58:12Z,Subject: Web Development
Hit the ground running with AngularJS with Dion Yang,100,Paid,4563,49,13,Beginner Level,4,1.5,2015-11-26T17:16:53Z,Subject: Web Development
Ultimate WordPress Plugin Course,100,Paid,4537,415,49,Beginner Level,4,9,2015-08-20T20:32:31Z,Subject: Web Development
Complete PHP Course with OOP Start to Finish!,200,Paid,4529,54,29,All Levels,4,2,2015-11-26T22:25:33Z,Subject: Web Development
Learn Bootstrap3 With Multi Purposes Single Page Layout,0,Free,4503,146,122,All Levels,4,21,2016-02-16T21:59:01Z,Subject: Web Development
Laravel Blog Development Starter,0,Free,4499,138,20,Beginner Level,4,2,2017-02-14T00:38:18Z,Subject: Web Development
Django + AngularJS for a Powerful Web Application,95,Paid,4463,59,36,Beginner Level,4,5.5,2016-10-13T17:34:00Z,Subject: Web Development
React.js Quickly: Developing Scalable Web User Interfaces,50,Paid,4447,76,24,Beginner Level,4,4,2016-04-19T17:27:00Z,Subject: Web Development
Power up HTML5 with JavaScript,100,Paid,4442,23,28,Beginner Level,4,2,2016-03-15T18:03:33Z,Subject: Web Development
HTML and CSS for Absolute Beginners,0,Free,4410,52,26,Beginner Level,4,3,2017-01-20T17:02:27Z,Subject: Web Development
JavaScript Fundamentals,0,Free,4409,71,100,All Levels,4,5,2016-12-20T15:34:05Z,Subject: Web Development
JQuery Create Overlay Popups from scratch using Jquery,50,Paid,4407,17,29,All Levels,4,2.5,2015-12-04T17:06:24Z,Subject: Web Development
Build CRUD Application - PHP & Mysql,0,Free,4405,71,12,Beginner Level,4,1.5,2017-05-04T16:47:24Z,Subject: Web Development
Angular 4: From Theory to Practice & FREE E-Book,200,Paid,4375,622,129,Beginner Level,4,15.5,2016-11-15T21:35:06Z,Subject: Web Development
How To Create A WordPress Website Without Paying A Developer,20,Paid,4333,16,17,All Levels,4,1,2014-10-20T11:53:12Z,Subject: Web Development
How To Create a Local Wordpress Environment,0,Free,4306,163,12,Beginner Level,4,0.5166666667,2016-02-07T18:58:40Z,Subject: Web Development
Install WordPress on Computer using XAMPP,0,Free,4290,150,15,All Levels,4,0.6166666667,2015-08-26T23:22:24Z,Subject: Web Development
Effective Personal Website Building and Hosting,20,Paid,4259,0,11,All Levels,4,1,2016-04-11T22:36:52Z,Subject: Web Development
Python Programming: Create an Digital Marketplace in Django,195,Paid,4198,145,161,All Levels,4,26,2013-10-20T19:53:28Z,Subject: Web Development
Learn JavaScript from scratch,20,Paid,4193,92,44,Beginner Level,4,2.5,2015-07-30T19:00:52Z,Subject: Web Development
A 13 Hour SQL Server 2014 /ASP.NET/CSS/C#/jQuery Course,35,Paid,4183,231,86,Beginner Level,4,14,2014-10-12T06:29:05Z,Subject: Web Development
AJAX : Let's build a COOL project,70,Paid,4183,292,38,All Levels,0,3.5,2015-03-13T23:11:17Z,Subject: Web Development
Angular 2 Master Class with Alejandro Rangel,30,Paid,4157,206,80,Beginner Level,4,9.5,2016-03-01T00:07:14Z,Subject: Web Development
How To Create A Wordpress Website 2016 | NEW Divi Theme 3.0!,40,Paid,4144,383,43,All Levels,5,5.5,2016-10-13T22:12:07Z,Subject: Web Development
Angular Styling & Animations (for Angular 2 and Angular 4),120,Paid,4138,307,107,Beginner Level,1,6,2017-03-28T00:01:39Z,Subject: Web Development
AngularJS Custom Directives with Dan Wahlin,75,Paid,4128,434,61,Beginner Level,4,6,2015-02-21T01:54:51Z,Subject: Web Development
Create and Deploy a Web App in 3 Hours,50,Paid,4123,23,34,All Levels,4,3.5,2013-12-04T22:49:28Z,Subject: Web Development
HTML and CSS Crash Course for Beginners,50,Paid,4123,46,31,Beginner Level,3,4.5,2014-05-30T22:23:01Z,Subject: Web Development
Mastering CSS 3.0 Selectors,0,Free,4115,63,13,All Levels,3,2,2017-02-22T21:57:35Z,Subject: Web Development
Introductory To HTML and CSS,50,Paid,4106,112,15,Intermediate Level,2,1,2016-08-27T21:35:25Z,Subject: Web Development
Web Development Masterclass - Complete Certificate Course,200,Paid,4090,178,348,All Levels,5,19.5,2016-10-12T03:14:13Z,Subject: Web Development
Create a Responsive Website with Bootstrap 3,50,Paid,4076,39,22,Beginner Level,5,3,2014-10-28T02:25:42Z,Subject: Web Development
Angular Masterclass,150,Paid,4057,359,99,All Levels,5,6.5,2016-05-09T22:29:32Z,Subject: Web Development
Intro to PHP Web Application Development with Symfony,200,Paid,4040,72,20,Beginner Level,5,1.5,2013-09-06T02:34:20Z,Subject: Web Development
"Create Complete Sign up System using PHP, jQuery and Ajax",200,Paid,4033,40,25,Intermediate Level,5,3,2016-02-15T00:41:18Z,Subject: Web Development
Basic HTML CSS and Web Design,30,Paid,4030,92,46,All Levels,5,9,2016-02-19T18:10:13Z,Subject: Web Development
JavaScript the Basics - JavaScript for Beginners,120,Paid,4028,674,93,Intermediate Level,5,9,2016-06-09T15:13:54Z,Subject: Web Development
Build Professional WordPress Website,145,Paid,4020,95,52,Intermediate Level,5,3.5,2015-01-14T09:02:00Z,Subject: Web Development
Learn HTML Fast and Easy!,20,Paid,4011,24,17,Intermediate Level,5,1.5,2015-08-03T22:01:42Z,Subject: Web Development
Creating Animations using HTML5 Canvas,25,Paid,4010,17,12,All Levels,5,1,2016-06-13T18:58:56Z,Subject: Web Development
Become PHP Facebook Developer: Password-Less Authentication,195,Paid,4001,8,37,All Levels,5,4,2017-05-07T19:30:36Z,Subject: Web Development
The Bubble Course - Create Complete Web Apps without Coding,30,Paid,3960,220,47,Beginner Level,5,4.5,2016-07-24T18:04:32Z,Subject: Web Development
Mastering Basic CSS Selectors.,0,Free,3933,23,14,All Levels,5,3,2017-05-09T22:13:22Z,Subject: Web Development
"Master JavaScript Programming, 3 Projects Included !!",20,Paid,3903,53,107,Beginner Level,3,10.5,2017-06-27T23:16:24Z,Subject: Web Development
Laravel(5.2) PHP Framework Jump Start for beginners,20,Paid,3898,95,32,Intermediate Level,1,3,2015-12-29T18:54:13Z,Subject: Web Development
Become a HTML and CSS Developer - Build a Responsive Site,0,Free,3894,91,29,All Levels,5,2,2016-05-26T04:46:39Z,Subject: Web Development
Complete HTML5 and CSS3 Course +1 Start to Finish Project,200,Paid,3887,81,94,All Levels,4,8.5,2015-09-07T23:42:50Z,Subject: Web Development
Laravel Homestead,0,Free,3883,110,9,Beginner Level,4,1,2016-12-07T03:43:24Z,Subject: Web Development
Wordpress for Beginners - Build a Live Website from Scratch,20,Paid,3877,92,15,Beginner Level,3,1.5,2015-09-09T17:53:26Z,Subject: Web Development
"Build Realtime Apps | React Js, Golang & RethinkDB",60,Paid,3854,482,48,Beginner Level,4,3,2016-01-29T20:30:27Z,Subject: Web Development
CSS3 for beginners,195,Paid,3831,15,25,Intermediate Level,2,1.5,2015-04-23T17:43:44Z,Subject: Web Development
WordPress local server setup and site migration online,55,Paid,3801,43,12,All Levels,2,1,2017-01-03T22:28:01Z,Subject: Web Development
How to Start a WordPress Blog - Complete Beginners Guide!,0,Free,3784,85,32,Intermediate Level,1,2,2017-01-02T23:07:34Z,Subject: Web Development
How To Create A Real Estate Website With Wordpress 2017,0,Free,3782,32,11,Beginner Level,3,1.5,2017-06-06T14:10:36Z,Subject: Web Development
WordPress Plugin Development for 2017 - Build 14 Plugins,50,Paid,3770,108,72,All Levels,4,7,2015-08-11T20:52:21Z,Subject: Web Development
Angular Material - Quickstart,0,Free,3766,135,14,All Levels,3,0.7,2017-03-09T22:12:32Z,Subject: Web Development
How To Make A Business Website In 1 Day With Wix FAST & EASY,20,Paid,3759,24,25,All Levels,5,4,2016-04-18T15:23:27Z,Subject: Web Development
Learn CSS Transition and Animation,100,Paid,3757,28,20,Beginner Level,1,1,2015-05-27T17:51:19Z,Subject: Web Development
Learn XML Crash Course: Discover Essential XML Fundamentals,50,Paid,3704,111,18,All Levels,4,2,2014-06-16T14:00:47Z,Subject: Web Development
PHP MVC Framework CodeIgniter Tutorial for Beginners Project,100,Paid,3701,508,125,Intermediate Level,2,10.5,2015-08-28T00:29:28Z,Subject: Web Development
Develop Your First App in an Hour,20,Paid,3699,201,11,Intermediate Level,5,1,2016-05-17T17:22:35Z,Subject: Web Development
Javascript for Beginners,20,Paid,3697,195,48,All Levels,1,3,2011-07-09T05:43:31Z,Subject: Web Development
WordPress for Beginners - Tutorial - From Novice to Know-How,20,Paid,3694,48,39,Beginner Level,1,4,2015-08-28T19:41:50Z,Subject: Web Development
"Build Your Own Calculator App with Javascript, HTML5 & CSS",50,Paid,3688,49,11,All Levels,3,1,2017-04-13T17:36:32Z,Subject: Web Development
Chrome Extensions : Develop 5 chrome extensions from scratch,0,Free,3655,85,44,Beginner Level,5,2,2017-03-30T15:22:46Z,Subject: Web Development
How to create HTML Forms,30,Paid,3652,60,7,All Levels,5,0.6666666667,2016-04-29T04:48:25Z,Subject: Web Development
VueJS V1 Introduction to VueJS JavaScript Framework,200,Paid,3632,28,31,Beginner Level,5,2,2016-07-26T16:53:56Z,Subject: Web Development
Learn JSON with JavaScript Objects and APIs in 1 hour,95,Paid,3619,93,19,Beginner Level,5,1,2016-10-26T14:19:40Z,Subject: Web Development
Web Design HTML CSS How to Create a Website from Scratch,50,Paid,3601,28,22,All Levels,5,2,2016-09-03T05:21:37Z,Subject: Web Development
The Complete Guide to JavaScript Development,110,Paid,3590,36,104,Intermediate Level,5,14,2016-01-25T04:46:37Z,Subject: Web Development
Build and Deploy a LAMP server on AWS,0,Free,3571,18,8,Beginner Level,5,1,2017-06-19T23:33:54Z,Subject: Web Development
JQuery Basics - Learn JQuery From Scratch,100,Paid,3559,24,18,Intermediate Level,5,1,2017-06-18T21:23:07Z,Subject: Web Development
How To Make A Wordpress Website 2017 | Divi Theme Tutorial,40,Paid,3541,202,37,Beginner Level,5,4,2017-01-26T22:15:02Z,Subject: Web Development
Email Marketing: Send Unlimited Emails via Own Mail Server,35,Paid,3539,43,20,All Levels,5,1,2017-04-19T00:28:15Z,Subject: Web Development
Create an eCommerce Wordpress Website 2016 - New Divi Theme!,30,Paid,3503,123,41,All Levels,5,4,2016-10-27T14:30:01Z,Subject: Web Development
How To Make an eCommerce Website With Wordpress 2017,0,Free,3493,43,26,Intermediate Level,5,4.5,2017-05-09T22:08:11Z,Subject: Web Development
A Complete Laravel basics from beginner to expert,25,Paid,3492,61,12,All Levels,5,1.5,2016-12-06T22:07:53Z,Subject: Web Development
Learn Ruby Programming The Easy Way,35,Paid,3485,22,19,Intermediate Level,3,2,2015-09-15T19:07:14Z,Subject: Web Development
The complete HTML5 course,20,Paid,3461,11,23,All Levels,2,1.5,2015-12-02T18:47:34Z,Subject: Web Development
All in one HTML CSS and JQuery,20,Paid,3444,35,16,All Levels,2,3,2017-01-27T22:27:20Z,Subject: Web Development
Professional Python Web Development Using Flask,120,Paid,3420,489,102,All Levels,1,14.5,2015-03-04T00:10:36Z,Subject: Web Development
Complete WordPress Theme Developer Course With Bootstrap,150,Paid,3415,312,160,All Levels,4,25,2016-07-01T20:06:13Z,Subject: Web Development
Create a classified website in 2 hours - guaranteed,50,Paid,3411,84,22,Intermediate Level,1,1,2013-11-09T09:36:07Z,Subject: Web Development
"Ajax in JavaScript and JQuery, with PHP - Creating Chat App",200,Paid,3399,85,15,All Levels,4,1.5,2015-07-27T20:23:28Z,Subject: Web Development
Become a Certified Web Developer - Beginner to Expert,200,Paid,3397,12,85,All Levels,4,8,2015-04-06T16:38:49Z,Subject: Web Development
Building Websites Create a fully functional Web contact form,200,Paid,3392,29,19,All Levels,5,1.5,2016-10-06T20:52:47Z,Subject: Web Development
Quick learning jQuery web development,150,Paid,3388,67,39,Beginner Level,4,3,2016-04-25T17:04:36Z,Subject: Web Development
HTML Made Simple For Beginners: Create a One Page Website,65,Paid,3380,50,16,Beginner Level,1,2,2015-10-14T22:08:17Z,Subject: Web Development
Complete Website & CMS in PHP & MySQL From Scratch!,20,Paid,3357,82,48,Intermediate Level,3,12.5,2014-04-18T09:51:00Z,Subject: Web Development
Angular 2 Routing: Up And Running,0,Free,3357,84,13,All Levels,3,0.6166666667,2017-02-21T23:34:56Z,Subject: Web Development
Up and Running with jQuery,0,Free,3324,138,19,Beginner Level,1,5,2017-02-03T23:23:30Z,Subject: Web Development
JSON Crash Course for Beginners,45,Paid,3323,90,7,Beginner Level,4,0.6333333333,2017-01-17T05:11:14Z,Subject: Web Development
"Build a Real Time web app in node.js , Angular.js, mongoDB",20,Paid,3299,166,34,Beginner Level,1,4,2015-03-04T00:11:45Z,Subject: Web Development
Full-Stack Web Apps with Meteor and React,85,Paid,3295,531,162,Beginner Level,5,31.5,2016-11-23T23:05:38Z,Subject: Web Development
Bootstrap 3 Beginners: Create a Professional Landing Page,20,Paid,3271,278,54,Beginner Level,5,2.5,2015-09-20T21:04:03Z,Subject: Web Development
introduction to HTML Course,20,Paid,3258,32,16,Expert Level,5,2,2016-05-16T15:14:17Z,Subject: Web Development
Coding Made Easy: HTML & CSS For Beginners,40,Paid,3254,92,16,Beginner Level,5,1.5,2016-06-07T17:35:07Z,Subject: Web Development
React From The Ground Up,150,Paid,3252,401,62,Intermediate Level,5,12.5,2016-05-02T21:59:07Z,Subject: Web Development
In Depth Web Development Made Easy,25,Paid,3249,27,60,All Levels,5,6.5,2015-10-30T16:55:44Z,Subject: Web Development
ES6 / EcmaScript 6 for beginners an introduction,0,Free,3227,19,21,All Levels,5,2,2017-06-22T22:01:11Z,Subject: Web Development
The Complete E-Commerce Web Developer Course 5.0,195,Paid,3209,58,96,All Levels,5,12.5,2016-09-13T16:12:58Z,Subject: Web Development
Learn JSON for beginners with JavaScript,200,Paid,3193,10,23,Beginner Level,5,1.5,2017-06-30T17:40:02Z,Subject: Web Development
Professional WordPress Theme Development For 2017,20,Paid,3185,102,94,Beginner Level,5,8,2015-05-08T19:10:30Z,Subject: Web Development
Professional Ruby on Rails Developer with Rails 5,200,Paid,3179,214,174,All Levels,5,20.5,2017-02-19T22:03:15Z,Subject: Web Development
Ethereum Developer: Build A Decentralised Blockchain App,195,Paid,3169,527,38,Beginner Level,5,3.5,2016-09-26T17:50:36Z,Subject: Web Development
Angular 2 Demystified,20,Paid,3150,69,49,All Levels,5,3.5,2015-05-18T20:48:48Z,Subject: Web Development
Ultimate JavaScript Strings,0,Free,3142,117,20,Beginner Level,4,0.6166666667,2016-07-29T12:53:13Z,Subject: Web Development
Scaling Docker on AWS,25,Paid,3133,351,63,All Levels,4,6,2016-03-28T17:51:04Z,Subject: Web Development
The Full Stack Web Development,60,Paid,3119,453,207,All Levels,4,33,2016-11-24T00:38:03Z,Subject: Web Development
Critical Web Dev Skills & Tools for the Non-Tech Hustler,0,Free,3118,8,33,All Levels,4,1.5,2016-12-20T22:39:30Z,Subject: Web Development
WordPress For Beginners | No Coding Required,20,Paid,3106,31,13,All Levels,4,1,2017-04-15T00:32:58Z,Subject: Web Development
Bootstrap 4 Responsive Web Design and Development,20,Paid,3086,17,73,All Levels,4,7.5,2017-06-20T16:24:37Z,Subject: Web Development
"Earn Big Profits With Web Development, Simple and Easy!",90,Paid,3073,27,13,Intermediate Level,4,1.5,2017-01-18T22:48:53Z,Subject: Web Development
Create Website from scratch in Urdu & Hindi,0,Free,3033,91,9,Beginner Level,4,1,2016-06-05T15:48:54Z,Subject: Web Development
Learn HTML5 At Your Own Pace. Ideal for Beginners,50,Paid,3026,60,67,All Levels,4,7,2012-02-28T18:52:32Z,Subject: Web Development
Expert Guide : Mastering Functions in JavaScript !,195,Paid,3015,30,19,All Levels,4,2.5,2015-06-19T22:58:29Z,Subject: Web Development
How to Create A Website: An HTML Tutorial and CSS Tutorial,65,Paid,3012,260,330,All Levels,4,32.5,2016-09-25T20:55:57Z,Subject: Web Development
AngularJS For ASP.NET MVC Developers,50,Paid,3011,57,10,All Levels,4,1,2015-02-23T15:11:20Z,Subject: Web Development
"Learn HTML, CSS, and Ruby on Rails: Build Your First Blog",20,Paid,2985,40,27,All Levels,4,1.5,2016-11-29T23:41:06Z,Subject: Web Development
jQuery for Beginners - Create Website Animations Easily,100,Paid,2971,285,28,Intermediate Level,4,3,2015-03-24T00:40:39Z,Subject: Web Development
Learn the basics of the Web development: Coding Tactics,40,Paid,2965,17,30,Beginner Level,4,2,2017-04-29T00:52:53Z,Subject: Web Development
Learn Ajax and jquery with PHP,20,Paid,2964,8,9,All Levels,4,1.5,2016-01-07T17:31:41Z,Subject: Web Development
"Essential JavaScript, jQuery and AngularJS Training",30,Paid,2919,136,70,All Levels,4,7,2015-07-09T22:41:32Z,Subject: Web Development
Introduction to HTML5 Canvas basics of drawing,200,Paid,2918,16,17,Beginner Level,4,1,2016-03-14T18:51:45Z,Subject: Web Development
AngularJS Masterclass - Deep Dive & Understand AngularJS,100,Paid,2912,309,85,All Levels,4,6,2015-03-04T22:52:26Z,Subject: Web Development
Wordpress Security,95,Paid,2888,26,24,All Levels,4,2.5,2015-04-13T17:53:02Z,Subject: Web Development
Learn Ruby on Rails for Absolute Beginners,195,Paid,2875,20,36,Beginner Level,4,4.5,2015-10-14T17:51:26Z,Subject: Web Development
First Web Application with Spring Boot,40,Paid,2865,95,32,Beginner Level,4,4,2017-01-27T16:45:13Z,Subject: Web Development
Build Responsive Websites in an Hour using Portalfin,0,Free,2859,42,17,All Levels,4,0.7333333333,2016-09-25T17:45:52Z,Subject: Web Development
Hosting your static website on Amazon AWS S3 service,20,Paid,2853,47,16,All Levels,1,1.5,2017-05-05T23:42:32Z,Subject: Web Development
"Create, Update and Manage Your Own Website Using Drupal 7",120,Paid,2837,68,49,All Levels,1,7,2013-10-16T21:22:35Z,Subject: Web Development
Create Your Own Successful Online School To Sell Courses,95,Paid,2814,14,39,All Levels,1,2,2014-11-18T04:02:55Z,Subject: Web Development
How to Build Chat Bots: From Beginner to Intermediate,140,Paid,2814,107,35,Intermediate Level,2,2,2016-10-03T21:00:58Z,Subject: Web Development
Dissecting Ruby on Rails 5 - Become a Professional Developer,195,Paid,2804,418,212,All Levels,5,37.5,2017-02-07T00:40:33Z,Subject: Web Development
"Basic Concepts of Web Development, HTTP and Java Servlets",35,Paid,2797,59,10,Beginner Level,5,1,2014-08-27T11:31:44Z,Subject: Web Development
JavaScript Design Patterns: 20 Patterns for Expert Code,95,Paid,2789,243,26,Beginner Level,5,3.5,2015-11-12T19:01:10Z,Subject: Web Development
Complete Codeigniter: From Beginner to Advanced,200,Paid,2786,31,20,Intermediate Level,5,3,2017-01-24T22:09:52Z,Subject: Web Development
Learn MeteorJS By Building 10 Real World Projects,50,Paid,2784,221,79,Intermediate Level,5,15,2015-07-28T17:23:14Z,Subject: Web Development
JavaScript For Beginners : Learn JavaScript From Scratch,195,Paid,11285,102,77,Intermediate Level,5,5.5,2017-02-07T17:20:39Z,Subject: Web Development
Practical CSS Website Development: Crash Course,95,Paid,11170,35,19,Beginner Level,5,2.5,2016-02-02T21:05:27Z,Subject: Web Development
Make a professional website - 30 Day Guarantee. Discounted!,20,Paid,11167,34,13,Beginner Level,5,2,2014-06-23T16:03:41Z,Subject: Web Development
Improved SEO with Rich Snippets and MicroData,0,Free,11026,228,13,Beginner Level,5,1,2014-06-09T10:35:40Z,Subject: Web Development
Automate Web Development With Gulp JS,20,Paid,2784,425,29,All Levels,5,3.5,2014-08-23T20:11:57Z,Subject: Web Development
Creating User Authentication System in CodeIgniter,200,Paid,2783,9,21,Beginner Level,5,1.5,2016-12-22T12:44:26Z,Subject: Web Development
How To Make A Wordpress Website 2017 - Divi Theme Tutorial,40,Paid,2780,94,29,All Levels,5,3,2017-01-26T17:16:27Z,Subject: Web Development
Web Programming Course : Asp.Net MVC,100,Paid,2760,76,26,All Levels,5,3.5,2015-07-13T22:58:32Z,Subject: Web Development
Node.js: The Essentials + API Frameworks Express KOA Sails,20,Paid,2760,52,34,All Levels,1,1,2017-02-16T21:59:01Z,Subject: Web Development
Become a Bootstrap Expert: Build 20 Layouts!,35,Paid,2755,57,179,Beginner Level,2,17.5,2016-02-08T00:54:34Z,Subject: Web Development
"Simple Javascript: Learn by Doing, Beginners Welcome!",25,Paid,2753,10,18,Beginner Level,3,2,2015-09-07T17:55:11Z,Subject: Web Development
Learn PHP Programming for Absolute Beginners - Lite,20,Paid,2749,62,7,Intermediate Level,3,0.6833333333,2015-12-15T20:46:34Z,Subject: Web Development
Building An E-Commerce Store Using Java Spring Framework,95,Paid,2743,589,61,All Levels,3,14.5,2016-02-01T17:27:04Z,Subject: Web Development
Learn To Program JavaScript (in ten easy steps),75,Paid,2721,96,44,Intermediate Level,4,5.5,2013-05-20T09:36:54Z,Subject: Web Development
BDD with Ruby on Rails using RSpec 3 and Capybara,175,Paid,2706,179,103,Beginner Level,2,13,2015-08-14T16:48:51Z,Subject: Web Development
Social Network Web Development,200,Paid,2698,29,57,All Levels,4,8,2013-09-03T06:29:24Z,Subject: Web Development
HTML & CSS From Scratch in 30 Days,75,Paid,2697,64,82,All Levels,2,11.5,2013-04-22T18:19:38Z,Subject: Web Development
"Beginner Full Stack Web Development: HTML, CSS, React & Node",200,Paid,2687,331,138,Beginner Level,3,25.5,2017-03-31T05:35:11Z,Subject: Web Development
Build Your Own Backend REST API using Django REST Framework,50,Paid,2669,112,72,Beginner Level,3,5.5,2017-04-27T19:21:11Z,Subject: Web Development
ASP.NET Web API 2 Hands-On,20,Paid,2660,276,16,Beginner Level,2,1.5,2016-06-19T20:10:58Z,Subject: Web Development
JavaScript Complete for beginners with real world Apps,120,Paid,2652,33,40,All Levels,4,3.5,2016-02-02T21:35:54Z,Subject: Web Development
WordPress Plugin Development -> Deep dive discovery!,40,Paid,2650,19,39,Beginner Level,1,2,2015-11-05T22:16:20Z,Subject: Web Development
The Complete Web Developer Course - Build 20 Websites,20,Paid,2650,61,304,All Levels,5,15.5,2015-03-26T22:11:15Z,Subject: Web Development
Optimizing Wordpress for More Speed and Revenue,0,Free,2649,16,7,All Levels,3,0.5833333333,2017-06-12T22:56:09Z,Subject: Web Development
Bootstrap Essential Training - Create Your Very Own Website,20,Paid,2643,34,83,All Levels,5,9,2016-02-19T18:17:05Z,Subject: Web Development
Master ExpressJS to Build Web Apps with NodeJS&JavaScript,50,Paid,2643,56,24,All Levels,3,3.5,2016-01-07T02:04:55Z,Subject: Web Development
Bootstrap 4 Theme Development Masterclass,150,Paid,2641,28,15,Intermediate Level,1,0.65,2017-02-24T02:29:03Z,Subject: Web Development
Ultimate CSS3 Course - From Beginners To Professional,95,Paid,2635,25,30,All Levels,2,2,2016-10-13T22:36:36Z,Subject: Web Development
PHP for Beginners,40,Paid,2626,95,135,Beginner Level,0,6,2015-07-01T18:55:13Z,Subject: Web Development
PHP Login and Registration System - Email Confirm Activation,100,Paid,2607,317,49,Beginner Level,1,5,2015-11-26T23:56:12Z,Subject: Web Development
Electron for Desktop Apps: The Complete Developer's Guide,50,Paid,2606,241,77,All Levels,2,8,2017-05-16T19:43:44Z,Subject: Web Development
Web Development Tools the Pros Use: Code Productivity Hacks,30,Paid,2596,11,39,All Levels,2,4,2015-10-08T18:13:22Z,Subject: Web Development
Spring Boot Tutorial For Beginners,40,Paid,2578,210,39,Beginner Level,1,5.5,2017-01-23T15:13:53Z,Subject: Web Development
ChatBots: Messenger ChatBot with API.AI and Node.JS,50,Paid,2577,529,64,All Levels,4,4.5,2016-06-30T16:57:08Z,Subject: Web Development
Hosting Django: Amazon Web Services (AWS) Fundamentals,45,Paid,2573,103,46,Intermediate Level,2,5.5,2015-10-19T21:30:02Z,Subject: Web Development
Learn JavaScript From Scratch:Become Top Rated Web Developer,65,Paid,2570,17,87,All Levels,3,5,2017-06-29T18:10:15Z,Subject: Web Development
Advanced Node.js Development,55,Paid,2565,32,41,All Levels,3,3,2014-08-28T03:35:30Z,Subject: Web Development
Learn JavaScript Dynamic Interactive Projects for Beginners,100,Paid,2558,12,36,Beginner Level,5,3,2016-02-14T18:51:48Z,Subject: Web Development
Learn jQuery AJAX in 1 hour,195,Paid,2547,62,18,All Levels,5,1,2016-10-27T18:01:40Z,Subject: Web Development
Intro to Git,20,Paid,2532,291,30,All Levels,5,1,2016-06-28T21:17:31Z,Subject: Web Development
Learn to Create Advance Responsive Websites With Bootstrap,20,Paid,2528,15,30,All Levels,5,2,2014-10-26T09:54:16Z,Subject: Web Development
Ruby On Rails For Web Development,195,Paid,2526,185,24,Intermediate Level,5,5,2014-12-17T19:01:59Z,Subject: Web Development
Creating a Responsive HTML Email,20,Paid,2520,183,34,All Levels,5,1.5,2013-08-12T13:09:39Z,Subject: Web Development
PHP Tutorial: Learn PHP Basic Programming for Beginners,20,Paid,2510,21,23,All Levels,5,1.5,2017-03-08T19:04:55Z,Subject: Web Development
"Core: A Web App Reference Guide for Django, Python, and More",195,Paid,2497,98,154,Intermediate Level,5,26,2014-05-29T00:58:43Z,Subject: Web Development
AngularJS For .Net Developers From Scratch,50,Paid,2494,303,40,All Levels,5,4.5,2016-03-09T20:03:42Z,Subject: Web Development
HTML & CSS for beginners: Build 3 projects from scratch,40,Paid,2472,139,31,Intermediate Level,5,4,2015-01-22T06:47:09Z,Subject: Web Development
HTML Forms For Beginners: A Basic Introduction,45,Paid,2472,41,8,Intermediate Level,5,1,2015-11-05T17:49:01Z,Subject: Web Development
